<?xml version="1.0" encoding="UTF-8" standalone="yes"?>
<sbe:messageSchema xmlns:sbe="http://fixprotocol.io/2017/sbe" xmlns:xsi="http://www.w3.org/2001/XMLSchema-instance" xmlns:xi="http://www.w3.org/2001/XInclude" package="examples" id="91" version="0" byteOrder="littleEndian" xsi:schemaLocation="http://fixprotocol.io/2017/sbe ../xsd/sbe-2.0rc2.xsd">
	<!-- include commonly used types -->
	<xi:include href="types-include.xml" parse="xml"/>
	<types>
		<type name="date" primitiveType="uint16"/>
		<type name="enumEncoding" primitiveType="char"/>
		<type name="idString" length="10" primitiveType="char"/>
		<type name="intEnumEncoding" primitiveType="uint8"/>
		<type name="currency" length="3" primitiveType="char" description="ISO 4217"/>
		<composite name="DATA">
			<type name="length" primitiveType="uint16"/>
			<type name="varData" length="0" primitiveType="uint8"/>
		</composite>
		<composite name="groupSizeEncoding">
			<type name="blockLength" primitiveType="uint16"/>
			<type name="numInGroup" primitiveType="uint16"/>
			<type name="numGroups" primitiveType="uint16"/>
			<type name="numVarDataFields" primitiveType="uint16"/>
		</composite>
		<composite name="componentSizeEncoding">
			<type name="blockLength" primitiveType="uint16"/>
			<type name="numInGroup" primitiveType="uint16" maxValue="1"/>
			<type name="numGroups" primitiveType="uint16"/>
			<type name="numVarDataFields" primitiveType="uint16"/>
		</composite>
		<composite name="messageHeader">
			<type name="blockLength" primitiveType="uint16"/>
			<type name="templateId" primitiveType="uint16"/>
			<type name="schemaId" primitiveType="uint16"/>
			<type name="version" primitiveType="uint16"/>
			<type name="numGroups" primitiveType="uint16"/>
			<type name="numVarDataFields" primitiveType="uint16"/>
		</composite>
		<composite name="decimalEncoding">
			<type name="mantissa" presence="optional" primitiveType="int64"/>
			<type name="exponent" presence="constant" primitiveType="int8">-3</type>
		</composite>
		<composite name="qtyEncoding">
			<type name="mantissa" primitiveType="int32"/>
			<type name="exponent" presence="constant" primitiveType="int8">0</type>
		</composite>
		<composite name="timestampEncoding" description="UTC timestamp with nanosecond precision">
			<type name="time" primitiveType="uint64"/>
			<type name="unit" primitiveType="uint8" presence="constant" valueRef="TimeUnit.nanosecond"/>
		</composite>
		<enum name="TimeUnit" encodingType="uint8">
			<validValue name="second">0</validValue>
			<validValue name="millisecond">3</validValue>
			<validValue name="microsecond">6</validValue>
			<validValue name="nanosecond">9</validValue>
		</enum>
		<enum name="businessRejectReasonEnum" encodingType="intEnumEncoding">
			<validValue name="Other">0</validValue>
			<validValue name="UnknownID">1</validValue>
			<validValue name="UnknownSecurity">2</validValue>
			<validValue name="ApplicationNotAvailable">4</validValue>
			<validValue name="NotAuthorized">6</validValue>
		</enum>
		<enum name="execTypeEnum" encodingType="enumEncoding">
			<validValue name="New">0</validValue>
			<validValue name="DoneForDay">3</validValue>
			<validValue name="Canceled">4</validValue>
			<validValue name="Replaced">5</validValue>
			<validValue name="PendingCancel">6</validValue>
			<validValue name="Rejected">8</validValue>
			<validValue name="PendingNew">A</validValue>
			<validValue name="Trade">F</validValue>
		</enum>
		<enum name="ordStatusEnum" encodingType="enumEncoding">
			<validValue name="New">0</validValue>
			<validValue name="PartialFilled">1</validValue>
			<validValue name="Filled">2</validValue>
			<validValue name="DoneForDay">3</validValue>
			<validValue name="Canceled">4</validValue>
			<validValue name="PendingCancel">6</validValue>
			<validValue name="Rejected">8</validValue>
			<validValue name="PendingNew">A</validValue>
			<validValue name="PendingReplace">E</validValue>
		</enum>
		<enum name="ordTypeEnum" encodingType="enumEncoding">
			<validValue name="Market">1</validValue>
			<validValue name="Limit">2</validValue>
			<validValue name="Stop">3</validValue>
			<validValue name="StopLimit">4</validValue>
		</enum>
		<enum name="sideEnum" encodingType="enumEncoding">
			<validValue name="Buy">1</validValue>
			<validValue name="Sell">2</validValue>
		</enum>
		<enum name="securityIdSourceEnum" encodingType="enumEncoding">
			<validValue name="CUSIP">1</validValue>
			<validValue name="SEDOL">2</validValue>
			<validValue name="QUIK">3</validValue>
			<validValue name="ISIN">4</validValue>
			<validValue name="RIC">5</validValue>
			<validValue name="CurrencyCode">6</validValue>
			<validValue name="CountryCode">7</validValue>
			<validValue name="ExchangeSymbol">8</validValue>
		</enum>
		<sbe:component name="instrumentBlock" id="1003" description="Reusable message fragment">
			<field name="SecurityID" id="48" type="idString" offset="0" semanticType="String"/>
			<field name="SecurityIDSource" id="22" type="securityIdSourceEnum" offset="10"/>
		</sbe:component>
	</types>
	<messages>
		<sbe:message name="ExecutionReport" id="98" blockLength="39" semanticType="8">
			<field name="OrderID" id="37" type="idString" offset="0" semanticType="String"/>
			<field name="ExecID" id="17" type="idString" offset="10" semanticType="String"/>
			<field name="ExecType" id="150" type="execTypeEnum" offset="20" semanticType="char"/>
			<field name="OrdStatus" id="39" type="ordStatusEnum" offset="21" semanticType="char"/>
			<field name="Side" id="54" type="sideEnum" offset="22" semanticType="char"/>
			<field name="LeavesQty" id="151" type="qtyEncoding" offset="23" semanticType="Qty"/>
			<field name="CumQty" id="14" type="qtyEncoding" offset="27" semanticType="Qty"/>
			<field name="TradeDate" id="75" type="date" offset="31" semanticType="LocalMktDate"/>
			<group name="Instrument" id="1003" blockLength="11" dimensionType="componentSizeEncoding" component="instrumentBlock"/>
			<group name="FillsGrp" id="2112" blockLength="12" dimensionType="groupSizeEncoding">
				<field name="FillPx" id="1364" type="decimalEncoding" offset="0" semanticType="Price"/>
				<field name="FillQty" id="1365" type="qtyEncoding" offset="8" semanticType="Qty"/>
			</group>
		</sbe:message>
		<sbe:message name="NewOrderSingle" id="99" blockLength="50" semanticType="D">
			<field name="ClOrdId" id="11" type="idString" offset="0" semanticType="String"/>
			<field name="Account" id="1" type="idString" offset="10" semanticType="String"/>
			<field name="Side" id="54" type="sideEnum" offset="20" semanticType="char"/>
			<field name="TransactTime" id="60" type="timestampEncoding" offset="21" semanticType="UTCTimestamp"/>
			<field name="OrderQty" id="38" type="qtyEncoding" offset="29" semanticType="Qty"/>
			<field name="OrdType" id="40" type="ordTypeEnum" offset="33" semanticType="char"/>
			<field name="Price" id="44" type="decimalEncoding" offset="34" semanticType="Price" presence="optional"/>
			<field name="StopPx" id="99" type="decimalEncoding" offset="42" semanticType="Price" presence="optional"/>
			<group name="Instrument" id="1003" blockLength="11" dimensionType="componentSizeEncoding" component="instrumentBlock"/>
		</sbe:message>
	</messages>
	<!-- include commonly used messages -->
	<xi:include href="messages-include.xml" parse="xml"/>
</sbe:messageSchema>
